{
    "id": "pt65",
    "metadata": {
        "name": "PT65",
        "authors": "Granada R., Trojahn C., Vieira R.",
        "urls": ["http://www.inf.pucrs.br/linatural/wikimodels/similarity.html"],
        "papers": [
            {
                "title": "Comparing Semantic Relatedness between Word Pairsin Portuguese Using Wikipedia",
                "url": "https://hal.science/hal-02089290/file/leitzkegranada_22675.pdf"
            }
        ],
        "date": "2014",
        "description": "Portuguese translation of the RG65 from Rubenstein and Goodenough (1965).",
        "downloadUrls": [
            "https://www.inf.pucrs.br/linatural/wordpress/recursos-e-ferramentas/lista-de-pares-de-palavras/"
        ],
        "languages": ["pt"],
        "domain": "general",
        "relationTypes": ["relatedness"]
    },
    "partitions": [
        {
            "id": "main",
            "relationType": "relatedness",
            "scale": {
                "value": {
                    "max": 4,
                    "min": 0
                }
            },
            "metrics": {
                "annotators": {
                    "total": 50,
                    "minEachPair": 50
                },
                "interAnnoAgreement": [
                    {
                        "method": "pearson",
                        "value": 0.71,
                        "metric": "unclear"
                    }
                ]
            }
        }
    ],
    "originalInstructions": ""
}
