{
  "id": "minimayoSRS",
  "metadata": {
    "name": "MiniMayoSRS",
    "urls": [
      "https://conservancy.umn.edu/handle/11299/196265"
    ],
    "papers": [
      {
        "title": "Measures of semantic similarity and relatedness in the biomedical domain",
        "url": "https://www.sciencedirect.com/science/article/pii/S1532046406000645?via%3Dihub"
      }
    ],
    "date": "2007",
    "description": "A subset of 29 medical concept pairs manually rater by medical coders for semantic relatedness with high inter-rater agreement.",
    "downloadUrls": [
      "https://conservancy.umn.edu/bitstream/handle/11299/196265/MiniMayoSRS.csv?sequence=2&isAllowed=y"
    ],
    "languages": [
      "en"
    ],
    "domain": "biomedical",
    "measureTypes": [
      "relatedness"
    ]
  },
  "partitions": [
    {
      "id": "physicians",
      "measureType": "relatedness",
      "scale": {
        "value": {
          "min": 1,
          "max": 4
        }
      },
      "metrics": {
        "annotators": {
          "total": 3,
          "minEachPair": 3
        },
        "interAgreement": {
          "pearson": 0.68,
          "spearman": null
        }
      }
    },
    {
      "id": "coders",
      "measureType": "relatedness",
      "scale": {
        "value": {
          "min": 1,
          "max": 4
        }
      },
      "metrics": {
        "annotators": {
          "total": 9,
          "minEachPair": 9
        },
        "interAgreement": {
          "pearson": 0.78,
          "spearman": null
        }
      }
    }
  ],
  "originalInstructions": ""
}
